text,title
アシタカはエボシに戦いをやめて村に帰るよう伝えるが、エボシはかまわずシシ神殺しに向い、遂にその首をとる。,もののけ姫
するとシシ神の体から不気味な液体が大量に飛び散り、それに触れた者たちは死に、木は枯れてしまう。,もののけ姫
やがて液体は津波のような勢いで山を埋め尽くし、森は枯れ果てて、タタラ場も壊滅してしまうのだった。,もののけ姫
サンは森が死んだと絶望し、人間に対する憎しみを爆発させる。,もののけ姫
しかし、アシタカはまだ望みはあるとサンを説得し、二人は協力して、シシ神の首を持って逃げようとするジコ坊を押しとどめ、首をシシ神に返す。,もののけ姫
シシ神は首を取り戻したが、朝日を浴びると同時に地に倒れて消える。,もののけ姫
その風が吹き抜けると、枯れ果てた山には僅かながら緑が戻り、アシタカの腕の呪いも消えた。,もののけ姫
アシタカは好きだが人間を許すことはできないと言うサンに、アシタカは、それでも互いの世界で共に生きようと語る。,もののけ姫
エボシもタタラ場の村人達に、新たに良い村を作りなおそうと語りかけるのだった。,もののけ姫
『千と千尋の神隠し』（せんとちひろのかみかくし）は、スタジオジブリの長編アニメーション映画。,千と千尋の神隠し
宮崎駿監督作品。,千と千尋の神隠し
千尋という名の10歳の少女が、引っ越し先へ向かう途中に立ち入ったトンネルから、神々の世界へ迷い込んでしまう物語。,千と千尋の神隠し
千尋の両親は魔女の湯婆婆によって豚に変えられてしまう。,千と千尋の神隠し
千尋は、湯婆婆の経営する銭湯で働きながら、両親とともに人間の世界へ帰るために奮闘する。,千と千尋の神隠し
声の出演は、柊瑠美・入野自由・夏木マリ・内藤剛志・沢口靖子・上條恒彦・小野武彦・菅原文太など。,千と千尋の神隠し
制作のきっかけは、宮崎駿の個人的な友人である10歳の少女を喜ばせたいというものだった。,千と千尋の神隠し
この少女は日本テレビの映画プロデューサー、奥田誠治の娘であり、主人公千尋のモデルになった。,千と千尋の神隠し
企画当時宮崎は、信州に持っている山小屋にジブリ関係者たちの娘を集め、年に一度合宿を開いていた。,千と千尋の神隠し
宮崎はまだ10歳前後の年齢の女子に向けた映画を作ったことがなく、そのため彼女たちに映画を送り届けたいと思うようになった。,千と千尋の神隠し
2001年7月20日に日本公開。,千と千尋の神隠し
興行収入は300億円を超え、日本歴代興行収入第1位を達成した。,千と千尋の神隠し
この記録は2017年現在も塗り替えられていない。,千と千尋の神隠し
第52回ベルリン国際映画祭では『ブラディ・サンデー』と同時に金熊賞を受賞した。,千と千尋の神隠し
宮崎の友人である映画監督ジョン・ラセターの尽力によって北米で公開され、第75回アカデミー賞ではアカデミー長編アニメ映画賞を受賞した。,千と千尋の神隠し
2016年のイギリスBBC主催の投票では、世界の177人の批評家が「21世紀の偉大な映画ベスト100」の第4位に選出した。,千と千尋の神隠し
10歳の少女、千尋は、両親と共に引越し先へと向かう途中、森の中の奇妙なトンネルから通じる無人の街へ迷い込む。,千と千尋の神隠し
そこは、怪物のような姿の八百万の神々が住む世界で、人間が来てはならないところだった。,千と千尋の神隠し
千尋の両親は飲食店で断りもなく飲み食いし、豚にされてしまう。,千と千尋の神隠し
千尋も帰り道を失って消えそうになるが、この世界に住む少年ハクに助けられる。,千と千尋の神隠し
ハクは、八百万の神々が客として集う「油屋」という名の湯屋で働いていた。,千と千尋の神隠し
油屋の主人は、相手の名を奪って支配する、恐ろしい魔女の湯婆婆（ゆばーば）である。,千と千尋の神隠し
仕事を持たない者は動物に変えられてしまうとハクは千尋に教える。,千と千尋の神隠し
千尋は、雇ってくれるよう湯婆婆に頼み込み、名を奪われて「千（せん）」と新たに名付けられ、油屋で働くことになる。,千と千尋の神隠し
ハクは、本当の名前を忘れると元の世界に戻れなくなると忠告する。,千と千尋の神隠し
ハクもまた名を奪われ、自分が何者であったのかを思い出せずにいた。,千と千尋の神隠し
しかし、彼はなぜか千尋を知っており、千尋のことを覚えているのだという。,千と千尋の神隠し
一方、千尋には、ハクの正体に心当たりがない。,千と千尋の神隠し
豚にされた両親を助けるため、油屋で働き始めた千尋だったが、彼女は人間であるために油屋の者たちから疎まれ、強烈な異臭を放つ客の相手まで押し付けられる。,千と千尋の神隠し
しかし彼女の実直な働きにより、客から大量の砂金が店にもたらされると、千尋は皆から一目置かれる存在になる。,千と千尋の神隠し
千尋はその客から不思議な団子を受け取る。,千と千尋の神隠し
翌日、ハクは湯婆婆の言いつけにより、彼女と対立している双子の姉の銭婆（ぜにーば）から、魔女の契約印を盗みだす。,千と千尋の神隠し
しかし、銭婆はハクを追ってきて魔法で重傷を負わせ、湯婆婆の息子である坊（ぼう）もネズミに変えてしまう。,千と千尋の神隠し
千尋はハクに不思議な団子を飲ませて助けるが、ハクは衰弱してしまう。,千と千尋の神隠し
千尋はハクを助けたい一心で、危険を顧みず銭婆のところへ謝りに行くことを決意する。,千と千尋の神隠し
そのころ油屋では、カオナシという化け物が従業員を飲み込んで暴れていた。,千と千尋の神隠し
カオナシは千尋から親切にされたことがあり、金や食べ物で千尋の気を引こうとするが、彼女が興味を示さないので激怒する。,千と千尋の神隠し
千尋は不思議な団子をカオナシに飲ませて従業員を吐き出させ、感謝される。,千と千尋の神隠し
千尋は、カオナシとネズミになった坊を伴って銭婆の家を訪れる。,千と千尋の神隠し
銭婆は千尋を穏やかに受け容れる。,千と千尋の神隠し
一方、意識を取り戻したハクは、坊が銭婆のところへ行ってしまったことを湯婆婆に伝える。,千と千尋の神隠し
ハクは、坊を連れ戻してくることを条件に、千尋と両親を解放するよう約束を迫り、帰る手段のなかった千尋を迎えに行く。,千と千尋の神隠し
ハクは銭婆から許され、千尋と共に油屋へ帰る。,千と千尋の神隠し
その途中で、千尋は自分が幼いころに落ちた「川」がハクの正体であることに気づく。,千と千尋の神隠し
幼いころハクの中で溺れそうになったとき、ハクは千尋を浅瀬に運び、助けあげた。,千と千尋の神隠し
千尋がハクの名前に気づくと、ハクも自分の名前を取り戻す。,千と千尋の神隠し
油屋に帰ったハクは、千尋と両親を解放するよう湯婆婆に要求する。,千と千尋の神隠し
従業員たちも、今度は千尋の味方である。,千と千尋の神隠し
湯婆婆は、油屋の前に集めた豚の中から両親を言い当てろと難題を課すが、千尋はこの中に両親はいないと正解を言い当てて自由となり、従業員たちに祝福されながら油屋を去る。,千と千尋の神隠し
ハクは千尋を途中まで見送り、自分も湯婆婆に暇を告げて元の世界に戻るつもりであると伝え、再会を期して別れる。,千と千尋の神隠し
人間に戻った両親は、最初のトンネルの前で、なにごともなかったかのように待っていた。,千と千尋の神隠し
もとの世界に戻った千尋が振り返ると、トンネルは来たときとは違う姿に変わっていた。,千と千尋の神隠し
『となりのトトロ』（英題：My Neighbor Totoro）はスタジオジブリの長編アニメーション映画。,となりのトトロ
宮崎駿監督作品。,となりのトトロ
昭和30年代前半の日本を舞台にしたファンタジー。,となりのトトロ
物語は、田舎へ引っ越してきた草壁一家のサツキ・メイ姉妹が、“もののけ”とよばれ、子どもの時にしか会えないと言われる不思議な生き物・トトロとの交流を描いていくストーリー。,となりのトトロ
声の出演は、日高のり子、坂本千夏、糸井重里、島本須美、高木均、北林谷栄など。,となりのトトロ
小学生のサツキと幼いメイは、父と一緒に田植え頃の農村へ引っ越してくる。,となりのトトロ
引越し先の空き家には小さな黒いオバケが沢山住んでいた。,となりのトトロ
それは子供にしか見えず、害もなく、人が住み始めるといつのまにか居なくなるという。,となりのトトロ
二人は入院している母に、オバケのことを報告する。,となりのトトロ
母がオバケ嫌いであることを心配したが、少しも怖がらずに「自分もオバケに会いたい」と言ってくれる母を見て、心強さを感じた二人は母が早く退院して一緒に暮らせることを願う。,となりのトトロ
サツキが小学校に通う日がやってくると、1人で遊んでいたメイは庭で不思議な生き物を見つける。,となりのトトロ
その生き物を追いかけて森に入ると、そこにはずっと大きな生き物が寝転んでいる。,となりのトトロ
その生き物にメイが名を尋ねると、"トトロ"と答えたようにメイには聞こえた。,となりのトトロ
メイはサツキや父にもトトロを見せようとするが、トトロが寝ていた場所が見つからない。,となりのトトロ
本当にトトロを見たと言い張るメイに、父は「トトロはきっと森の主で、いつでも会えるわけではないのだ」と優しく諭す。,となりのトトロ
梅雨の季節となったある夜、サツキとメイが森にあるバス停で父の帰りを待っていると、そこにトトロがやって来る。,となりのトトロ
サツキがトトロに傘を貸してやると、トトロはお礼に木の実を渡し、バスの姿をしたネコ（ネコバス）に乗って行ってしまう。,となりのトトロ
二人は木の実を庭にまいたが、なかなか芽が出ない。,となりのトトロ
すると二人はトトロの夢をみる。,となりのトトロ
夢の中で木の実は巨木へと育ち、二人はトトロと共に空を飛ぶ。,となりのトトロ
目が覚めると巨木は消えていたが、かわりに小さな芽が生えていた。,となりのトトロ
それを見た二人は、夢だけど夢ではなかったと大喜びする。,となりのトトロ
夏となったある日に、二人がトウモロコシを収穫していると、病院から突然の連絡が入る。,となりのトトロ
母が体調を崩してしまい退院が延びるというのだ。,となりのトトロ
不安になったサツキは母が死ぬかもしれないと泣き出し、それを見たメイは1人で病院に向ってしまう。,となりのトトロ
村中でメイを探すが見つからない。,となりのトトロ
途方にくれたサツキがトトロに助けを求めると、トトロがネコバスを呼んでくれる。,となりのトトロ
サツキを乗せたネコバスは風のように走り、道に迷っていたメイを見つける。,となりのトトロ
メイは母にトウモロコシを持って行きたかったという。,となりのトトロ
ネコバスは二人を病院に連れて行く。,となりのトトロ
そこには元気そうに父と話す母の姿があり、それを見た二人は安心する。,となりのトトロ
母が二人の気配に気づくと、そこにはメイが持ってきたトウモロコシが置かれていた。,となりのトトロ
『ハウルの動く城』（ハウルのうごくしろ）は日本の長編アニメーション映画。,ハウルの動く城
 スタジオジブリが製作し、日比谷スカラ座（現：TOHOシネマズスカラ座）を筆頭に東宝系で2004年11月20日に公開された。,ハウルの動く城
 監督は宮崎駿。,ハウルの動く城
 イギリスの作家ダイアナ・ウィン・ジョーンズのファンタジー小説『魔法使いハウルと火の悪魔』（原題:Howl’s Moving Castle）を原作とし、呪いで老婆にされた少女ソフィーと魔法使いハウルの奇妙な共同生活が、宮崎監督により「戦火の恋」を柱として脚色され描かれている。,ハウルの動く城
物語前半は比較的原作に準じているが、後半は原作には無かった戦争が付け加えられるなど全く違った展開になっている。,ハウルの動く城
原作者のジョーンズは「ハウルの性格を変えないように」とだけ注文をつけ、映画の感想を「とても素晴らしかった」「宮崎は私が執筆したときと同じ精神で映画を作った」と語っている。,ハウルの動く城
スタジオジブリの宮崎駿監督の長編映画としては『魔女の宅急便』以来、15年振りとなる他者原作の作品となった。,ハウルの動く城
帽子屋の少女ソフィーは、兵隊にからまれていた所を魔法使いのハウルに助けられる。,ハウルの動く城
しかしハウルも、彼をつけ狙う"荒地の魔女"に追われているところだった。,ハウルの動く城
その後ハウルと別れたソフィーはその夜、魔女の呪いで90歳の老婆に姿を変えられてしまう。,ハウルの動く城
帽子屋に居られなくなり、街を出たソフィーは、荒地で不思議なカカシの"カブ"を助け、彼が連れてきたハウルの動く城に出会う。,ハウルの動く城
城の暖炉には火の悪魔カルシファーがいた。,ハウルの動く城
彼はハウルとの契約に縛られてこき使われており、自らの魔力で城を動かしていた。,ハウルの動く城
彼はソフィーに、ハウルとの契約の謎を解いて、自由にしてほしいと頼んでくる。,ハウルの動く城
その後、ソフィーは城の掃除婦になるとハウルに言って、そのまま城に住むことになる。,ハウルの動く城
隣国との戦争が始まると、王に仕える魔法使いのマダム・サリマンがハウルに国への協力を求めてくる。,ハウルの動く城
サリマンはハウルの昔の師匠で、悪魔と取引をしたハウルが彼女の元を去ったことを嘆いていた。,ハウルの動く城
彼女はハウルが協力するならば悪魔と手を切る方法を教え、協力しないならば魔力を奪うという。,ハウルの動く城
悪魔と取引していた荒地の魔女も、サリマンに魔力を奪われてしまう。,ハウルの動く城
ハウルとともにサリマンと面会したソフィーはサリマンの前でハウルを弁護したが、サリマンは国に協力しないハウルを襲い、その後も彼を狙い続ける。,ハウルの動く城
ハウルはサリマンから隠れるため、それまで住んでいた城からソフィーの帽子屋へ魔法で引越しをする。,ハウルの動く城
魔力を奪われて普通の老婆に戻ってしまった荒地の魔女も家族に加わることになる。,ハウルの動く城
しかし町は空襲を受け、ハウルはソフィーを守るためと言い、戦いに行ってしまう。,ハウルの動く城
ソフィーは、彼が戦うのは町に彼女達がいるからだと考え、帽子屋を出て荒地の城に戻り、それからハウルを助けに行こうとする。,ハウルの動く城
その時、荒地の魔女が、彼女が欲しがっていたハウルの心臓をカルシファーが持っていたことに気づく。,ハウルの動く城
彼女はカルシファーに手を触れて火達磨となり、ソフィーは思わず2人に水を掛けてしまう。,ハウルの動く城
するとカルシファーの魔力に支えられていた城は途端に崩壊し、ソフィーはその残骸と共に谷底へ落ちる。,ハウルの動く城
谷底でソフィーは、ドアの残骸の先が別の世界とつながっていることに気づき、その世界で子供時代のハウルを見つける。,ハウルの動く城
ハウルが流星を飲み込み、胸から火に包まれた心臓を取り出すのを見たソフィーは、彼に「きっと行くから未来で待ってて」と叫びながら元の世界に帰る。,ハウルの動く城
この時、いつの間にか彼女の姿は老婆から少女に戻っていた。,ハウルの動く城
元の世界では、悪魔のような姿に変わり果てたハウルが、精気を失った顔で待っていた。,ハウルの動く城
ハウルが自分をずっと待ってくれていたのだと、ソフィーは気づく。,ハウルの動く城
ソフィーが荒地の魔女からハウルの心臓を受け取って彼の胸に戻すと、流星に戻ったカルシファーは自由になって飛び去り、ハウルも精気を取り戻す。,ハウルの動く城
カルシファーの魔力に支えられていた城の残骸が崩れ、乗っていたソフィー達は谷へ落ちそうになるが、突然現れたカカシのカブが身を投げ出して防ぐ。,ハウルの動く城
ソフィーがカブに感謝のキスをすると、カブは人間の姿に変わる。,ハウルの動く城
彼の正体は呪いを掛けられていた隣国の王子で、国に戻って戦争を終らせるという。,ハウルの動く城
その様子を魔法で見ていたサリマンは、このバカげた戦争を終らせようとつぶやく。,ハウルの動く城
自由になったカルシファーも、みんなといたいと言って帰ってきた。,ハウルの動く城
新しくなった城でソフィーとハウルはキスをする。,ハウルの動く城
そしてハウルの動く城は、皆を乗せて青空を飛んでいくのだった。,ハウルの動く城
『天空の城ラピュタ』（てんくうのしろラピュタ）は1986年に制作されたスタジオジブリ初制作の宮崎駿監督の長編アニメーション作品。,天空の城ラピュタ
監督である宮崎の小学校時代に考えていた架空の作品が骨子となっており、原作となる作品が存在しない初のアニメオリジナルの監督作品である。,天空の城ラピュタ
製作は徳間書店。,天空の城ラピュタ
高畑勲の映画『柳川堀割物語』の製作遅延により資金調達に追われた宮崎が、徳間書店の鈴木敏夫に相談したことから企画が立ち上げられ、この映画をきっかけに設立されたスタジオジブリ制作映画の1作品目となった。,天空の城ラピュタ
次第に高年齢向けになっていくアニメに対して、マンガ映画の復活を目標に小学生を対象に古典的な冒険活劇として企画され、それが結果的に大人の鑑賞に耐えうる作品になるというのが宮崎の方針であった。,天空の城ラピュタ
音楽は冒険活劇ということから宇崎竜童に決定していたが、プロデューサーの高畑勲の再考により『風の谷のナウシカ』の久石譲が続投することになった。,天空の城ラピュタ
興行こそ数字的には振るわなかったものの（後述）、配給した東映による観客満足度調査は97.7%と高く、物語は幅広い年齢層に支持され、ビデオ販売は好調であった。,天空の城ラピュタ
「ラピュタ」という名称は、スウィフトの『ガリヴァー旅行記』に登場する、空を飛ぶ島にある王国「ラピュタ王国（en:Laputa）」からとったもの。,天空の城ラピュタ
劇中に空飛ぶ島の物語を空想した人物としてスウィフトの名前も出てくるが、名前の借用以外は『ガリヴァー旅行記』との関連はない。,天空の城ラピュタ
19世紀後半、産業革命期のヨーロッパを元にした架空世界での冒険を描く。,天空の城ラピュタ
少女シータは、政府の特務機関に捕らえられ飛行船に乗せられていた。,天空の城ラピュタ
彼らの狙いはシータが亡き母から受け継いだ、謎の青い石だった。,天空の城ラピュタ
そこへその石を同じく狙う海賊ドーラ一家の襲撃があり、逃げようとしたシータは誤って飛行船から落ちる。,天空の城ラピュタ
シータは石が放つ不思議な光に包まれて気を失いながらゆっくりと落ちて行き、鉱山で働く少年パズーに助けられる。,天空の城ラピュタ
パズーはシータが追われていることを知り、彼女を守って共に逃げる。,天空の城ラピュタ
ドーラ一家に追われた二人は谷に落ちるが、石の力によって再び救われる。,天空の城ラピュタ
石に詳しい老人ポムによればそれは昔ラピュタで作られた飛行石だという。,天空の城ラピュタ
ラピュタは空に浮かぶという伝説の城だが、パズーの亡き父はラピュタを見ており、ラピュタへ行くのはパズーの夢だった。,天空の城ラピュタ
不思議なことにシータの家には"ラピュタ"という秘密の名前も受け継がれていた。,天空の城ラピュタ
老人と別れ、地上に戻った二人は特務機関に捕まり、軍の要塞へ連行される。,天空の城ラピュタ
そこでシータは特務機関を指揮するムスカ大佐から、昔ラピュタから落ちてきた壊れたロボット兵を見せられる。,天空の城ラピュタ
ラピュタは遠い昔に滅びたが、かつて高度な科学力で天空から世界を支配した恐怖の帝国であり、今も空のどこかに浮いているという。,天空の城ラピュタ
飛行石はラピュタの王族が、いつかラピュタに帰るために代々受け継ぐ物だった。,天空の城ラピュタ
ムスカはシータがラピュタ王の末裔だと明かす。,天空の城ラピュタ
ラピュタが平和にとって危険であるとムスカはラピュタ探索への協力を求め、パズーの命を盾とされたシータは、やむなくそれを受け入れる。,天空の城ラピュタ
その夜、シータは昔教わった"困った時のおまじない"を何げなく唱える。,天空の城ラピュタ
彼女は知らなかったが、それはラピュタの封印を解く言葉だった。,天空の城ラピュタ
その言葉によりロボット兵は目覚めて暴れ出し、石は空に光を放ってラピュタの位置を指し示す。,天空の城ラピュタ
一方ムスカに解放されたパズーは、石を狙っている海賊のドーラに捕まる。,天空の城ラピュタ
パズーはドーラが石を奪いに要塞へ行くことを知り、自分も連れて行くように求める。,天空の城ラピュタ
その方がシータが言うことを聞くと考えたドーラはそれを許し、ロボットによって混乱する要塞から協力してシータを救い出す。,天空の城ラピュタ
しかし、石はムスカの手に渡り、彼は軍と共にラピュタに出発する。,天空の城ラピュタ
パズーとシータもドーラの飛行船に乗せてもらい、ラピュタへと向かう。,天空の城ラピュタ
だが、ドーラの飛行船は軍に発見され雲間に逃れるも再度遭遇し攻撃されてしまう。,天空の城ラピュタ
ドーラの命令で見張り台を切り離してグライダーとして使用していたパズーとシータは軍の攻撃により繋ぎ止めていたワイヤーが断ち切られ、飛行船とはぐれて嵐に飲み込まれてしまう。,天空の城ラピュタ
雷に打たれたパズーは目前に現れた青白い飛行船に導かれてラピュタに辿り着く。,天空の城ラピュタ
そこには軍に捕まったドーラ一家の姿があった。,天空の城ラピュタ
