text,title
パズーはドーラを助けるが、シータはムスカに捕まってしまう。,天空の城ラピュタ
ムスカの本当の狙いとは、ラピュタの力を手に入れて世界を支配することだった。,天空の城ラピュタ
ムスカはシータに自分もラピュタ王の末裔だと明かし、飛行石で城の力を操って、軍の兵隊を皆殺しにする。,天空の城ラピュタ
それを見たシータはムスカから飛行石を奪って逃げ、昔教わった滅びの言葉「バルス」をパズーと共に唱える。,天空の城ラピュタ
すると城は崩壊し、ムスカは瓦礫と共に海へ落ちる。,天空の城ラピュタ
パズーとシータはグライダーで城から離れ空でドーラ一家と再会して喜び合う。,天空の城ラピュタ
彼らと別れ、二人は灯がともり始めた港町へ、ゆっくりと降りていった。,天空の城ラピュタ
『紅の豚』（くれないのぶた）は、スタジオジブリ制作の日本の長編アニメーション作品。,紅の豚
アニメーション映画として1992年7月18日から東宝系で公開された。,紅の豚
監督は宮崎駿。,紅の豚
前作の『魔女の宅急便』に続いて劇場用アニメ映画の興行成績日本記録を更新した。,紅の豚
この作品以降、スタジオジブリ映画における宮崎駿監督作品は全て東宝系での公開となった。,紅の豚
スタジオジブリ作品では初めて、ヒロイン役を演じた役者本人が主題歌を歌っている。,紅の豚
世界大恐慌時のイタリア、アドリア海を舞台に、飛行艇を乗り回す海賊ならぬ空賊（空中海賊）と、それを相手に賞金稼ぎで生きるブタの姿をした退役軍人操縦士の物語。,紅の豚
日本航空での機内上映用として製作が開始されたが、長編化したため、劇場公開されることとなった。,紅の豚
このため、劇場公開より先に日本航空国際便機内で先行上映され、劇場公開後も機内上映は続けられた。,紅の豚
2007年9月には、日本航空国際線機内で「紅の豚」の再上映が行われた。,紅の豚
原案は、月刊誌『モデルグラフィックス』の連載漫画記事宮崎駿の雑想ノートの「飛行艇時代」である[注 1]。,紅の豚
生家が航空機産業に関係していたため、幼い頃から空を飛ぶことに憧れていた宮崎が、自分の夢として描いた作品である。,紅の豚
宮崎自身がその演出覚書において、「疲れて脳細胞が豆腐になった中年男のためのマンガ映画」にしたいと記している。,紅の豚
本編制作中にプロデューサー鈴木敏夫の製作した宣伝用予告映像は、過激な空戦シーンを中心に繋いだ戦争映画さながらのものだった。,紅の豚
まるで本編と方向性の異なるイメージで作られたそれに対し、宮崎は猛烈に怒ったという。,紅の豚
加藤登紀子が主題歌とエンディング曲を歌うと共に、声優としても出演している。,紅の豚
作品世界は、宮崎自身の趣味を反映し、それまでの「子供向け」ではなく同年代に向けた作品となっている。,紅の豚
一貫してアニメを児童のために作ることを自らに課してきた宮崎にとっては、製作後も是非を悩み続ける作品となった。,紅の豚
一方で「イタリア人すら忘れてしまった航空機を復活させたり、存在しない空軍を出せたりしたことは道楽としては楽しかった」とも語っている。,紅の豚
また、借りぐらしのアリエッティ製作時のインタビューで「紅の豚の続編をやりたい」、「題名は「ポルコ・ロッソ 最後の出撃」」と語っており、宮崎の思い入れが非常に強いことが伺える。,紅の豚
他のジブリ作品同様に『金曜ロードSHOW!』で繰り返し放送されており、宮崎が長編アニメ製作からの引退会見を行った2013年9月6日には当初の放送予定を変更して急遽オンエアされている。,紅の豚
第一次世界大戦で戦勝国だったイタリア王国だが、国民から「栄光なき勝利」と呼ばれるまでに経済が不安定になっていた。,紅の豚
本編は1929年頃の物語[注 2]で、既にイタリアは1922年のローマ進軍以来、ムッソリーニ率いるファシスト党の独裁下となっている。,紅の豚
1931年から本格的にヨーロッパへ波及する大恐慌の足音や、この当時一世を風靡したアニメーション、ベティ・ブープに似た映画、ライバル役のカーチスが1933年のラジオドラマ『ローン・レンジャー』の名台詞「ハイヨー、シルバー!」を口にするなど、当時の世情を伺わせる描写が散りばめられている。,紅の豚
作品名の「紅」とは主人公の駆る飛行艇の機体色だが、国家対抗の色合いが強かった当時のカーレースにおけるイタリア人レーサー搭乗車のボディーカラーもまた、イタリア語で「レーシングの赤」を意味する「ロッソ・コルサ」であり、イギリスの緑、フランスの青、ドイツの黒と並んで「イタリアン・カラー」と呼ばれていた。,紅の豚
深紅の飛行艇を駆る豚のポルコは、かつてイタリア空軍のエースだったが、今はアドリア海の小島に隠棲し、空中海賊（空賊）退治を請け負う賞金稼ぎとして生きていた。,紅の豚
マンマユート団たち空賊連合は、いつも商売の邪魔をするポルコを目の敵にしている。,紅の豚
ある晩、昔馴染みのジーナが営むホテル・アドリアーノに出かけたポルコは、米国製の飛行艇を操るアメリカ人カーチスに出会う。,紅の豚
カーチスは空賊連合が雇った用心棒だった。,紅の豚
しばらく後、愛艇のエンジン整備のためミラノに向かって飛んでいたポルコは、カーチスと遭遇し撃墜されてしまう。,紅の豚
ポルコが大破した愛艇をミラノの工房ピッコロ社に持ち込むと、待っていたのはピッコロの孫で17歳の少女フィオだった。,紅の豚
ポルコは驚くが、フィオの熱意に絆されて設計を任せる。,紅の豚
一方、ファシスト政権に非協力的なポルコは、ミラノでも秘密警察や空軍に狙われていることが判る。,紅の豚
警告に来たかつての戦友は空軍への復帰を薦めるが、ポルコにそのつもりはない。,紅の豚
ホテル・アドリアーノでは一目ぼれしたカーチスがジーナに求婚するが、ジーナはポルコを待ち続けていた。,紅の豚
フィオの才能と献身によって復活した愛艇を駆り、ファシストの追手も振り切ってポルコがアドリア海に帰還すると、空賊連合が待ち受けていた。,紅の豚
フィオの提案で、ポルコとカーチスの決闘が組まれ、ポルコはフィオを、カーチスはポルコの修理代金を賭けて戦うことになる。,紅の豚
決闘当日、イタリア中の飛行艇乗りやならず者が見物に集まる一方で、ジーナは空軍の大編隊がポルコと空賊を一網打尽にしようと襲撃を計画していることを察知していた。,紅の豚
ポルコとカーチスのドッグファイトは決着がつかず、決闘は殴り合いにもつれ込む。,紅の豚
危機を知らせにジーナが駆けつけると、二人ともノックアウトされているが、ポルコが辛うじて立ち上がり勝者となる。,紅の豚
その後、フィオはピッコロ社を継ぎ、ジーナと親交を温める。,紅の豚
カーチスはアメリカに帰国後、ハリウッドスターになる。,紅の豚
そして、ホテル・アドリアーノの上空を紅い飛行艇が飛んでゆく。,紅の豚
ポルコが人間に戻ったのか、ジーナと結ばれたのかは明かされないまま、物語は幕を閉じる。,紅の豚
